{
  "schemaVersion": 1,
  "researchSnapshotAt": "2026-08-10T19:41:32.000Z",
  "target": {
    "nodeKey": "dgx-spark-dev-01",
    "architecture": "linux/arm64/v8",
    "accelerator": "nvidia-gb10-blackwell",
    "unifiedMemoryBytes": 137438953472,
    "containerFirst": true
  },
  "downloadGate": {
    "metadataOnlyDuringDiscovery": true,
    "requireExactRevision": true,
    "requireReviewedLicense": true,
    "requireChecksumBeforeCommit": true,
    "allowedLicenseReviewStates": [
      "approved"
    ]
  },
  "coverage": [
    "llm_agent",
    "large_nvfp4_llm",
    "image_drawing",
    "ocr",
    "asr",
    "translation"
  ],
  "researchSources": [
    {
      "sourceId": "nvidia.spark.hardware",
      "publisher": "NVIDIA",
      "uri": "https://docs.nvidia.com/dgx/dgx-spark/hardware.html",
      "retrievedAt": "2026-08-10T19:41:32.000Z"
    },
    {
      "sourceId": "nvidia.spark.trtllm",
      "publisher": "NVIDIA",
      "uri": "https://build.nvidia.com/spark/trt-llm/overview",
      "retrievedAt": "2026-08-10T19:41:32.000Z"
    },
    {
      "sourceId": "nvidia.spark.nvfp4",
      "publisher": "NVIDIA",
      "uri": "https://build.nvidia.com/spark/nvfp4-quantization/overview",
      "retrievedAt": "2026-08-10T19:41:32.000Z"
    },
    {
      "sourceId": "nvidia.spark.comfyui",
      "publisher": "NVIDIA",
      "uri": "https://build.nvidia.com/spark/comfy-ui/overview",
      "retrievedAt": "2026-08-10T19:41:32.000Z"
    },
    {
      "sourceId": "nvidia.nemotron.quantization",
      "publisher": "NVIDIA",
      "uri": "https://docs.nvidia.com/nemotron/latest/nemotron/super3/quantization.html",
      "retrievedAt": "2026-08-10T19:41:32.000Z"
    },
    {
      "sourceId": "openai.whisper",
      "publisher": "OpenAI",
      "uri": "https://github.com/openai/whisper/tree/v20250625",
      "retrievedAt": "2026-08-10T19:41:32.000Z"
    },
    {
      "sourceId": "paddle.ocr",
      "publisher": "PaddlePaddle",
      "uri": "https://huggingface.co/PaddlePaddle/PaddleOCR-VL-1.5",
      "retrievedAt": "2026-08-10T19:41:32.000Z"
    },
    {
      "sourceId": "google.madlad",
      "publisher": "Google",
      "uri": "https://huggingface.co/google/madlad400-3b-mt",
      "retrievedAt": "2026-08-10T19:41:32.000Z"
    }
  ],
  "candidates": [
    {
      "candidateId": "qwen36-35b-a3b-bf16",
      "role": "baseline",
      "useCases": [
        "llm_agent"
      ],
      "source": {
        "publisher": "Qwen",
        "repository": "Qwen/Qwen3.6-35B-A3B",
        "revision": "995ad96eacd98c81ed38be0c5b274b04031597b0",
        "provenanceUri": "https://huggingface.co/Qwen/Qwen3.6-35B-A3B/tree/995ad96eacd98c81ed38be0c5b274b04031597b0",
        "artifactSourceUri": "https://huggingface.co/Qwen/Qwen3.6-35B-A3B/resolve/995ad96eacd98c81ed38be0c5b274b04031597b0/",
        "gated": false,
        "reportedRepositoryBytes": 71921347477
      },
      "license": {
        "identifier": "Apache-2.0",
        "usage": "commercial",
        "reviewStatus": "approved",
        "reviewedAt": "2026-08-10T19:41:32.000Z",
        "reviewedBy": "model-discovery-policy-v1",
        "evidenceUri": "https://huggingface.co/Qwen/Qwen3.6-35B-A3B/blob/995ad96eacd98c81ed38be0c5b274b04031597b0/LICENSE",
        "evidenceDigest": "sha256:50cbab8a892c5f2993b8c7351a99182507472def3b1374558308605d99b86b32",
        "conditions": [
          "Retain Apache-2.0 notices when distributing model materials."
        ]
      },
      "artifactDecision": {
        "status": "allowed",
        "reason": "Ungated publisher revision and permissive license; import still requires file checksums and quota reservation.",
        "maximumDownloadBytes": 75000000000,
        "downloadState": "not_downloaded",
        "allowPatterns": [
          "*.json",
          "*.jinja",
          "*.safetensors",
          "*.model",
          "tokenizer*"
        ]
      },
      "precision": {
        "kind": "bf16",
        "nvfp4Applicability": "baseline-for-nvfp4",
        "evidenceUri": "https://build.nvidia.com/spark/nvfp4-quantization/overview",
        "baselineCandidateId": null,
        "comparisonReferences": []
      },
      "engine": {
        "name": "ngc-vllm",
        "compatibilityStatus": "documented-on-spark",
        "targetArchitecture": "linux/arm64/v8",
        "resourceMode": "node-exclusive",
        "notes": "High-precision quality reference. Weight size is not a deployability claim; load/KV/workspace must be measured with the core-service reserve intact."
      },
      "selection": {
        "status": "planned",
        "rationale": "Exact high-precision reference for the primary Qwen3.6 NVFP4 profile."
      }
    },
    {
      "candidateId": "qwen36-35b-a3b-nvfp4",
      "role": "primary",
      "useCases": [
        "llm_agent",
        "large_nvfp4_llm"
      ],
      "source": {
        "publisher": "NVIDIA/Qwen",
        "repository": "nvidia/Qwen3.6-35B-A3B-NVFP4",
        "revision": "491c2f1ea524c639598bf8fa787a93fed5a6fbce",
        "provenanceUri": "https://huggingface.co/nvidia/Qwen3.6-35B-A3B-NVFP4/tree/491c2f1ea524c639598bf8fa787a93fed5a6fbce",
        "artifactSourceUri": "https://huggingface.co/nvidia/Qwen3.6-35B-A3B-NVFP4/resolve/491c2f1ea524c639598bf8fa787a93fed5a6fbce/",
        "gated": false,
        "reportedRepositoryBytes": 23462477790
      },
      "license": {
        "identifier": "Apache-2.0",
        "usage": "commercial",
        "reviewStatus": "approved",
        "reviewedAt": "2026-08-10T19:41:32.000Z",
        "reviewedBy": "model-discovery-policy-v1",
        "evidenceUri": "https://huggingface.co/nvidia/Qwen3.6-35B-A3B-NVFP4/blob/491c2f1ea524c639598bf8fa787a93fed5a6fbce/README.md",
        "evidenceDigest": "sha256:bb3a29ef8870dd68be8a0e0d508880dd49a4db5aafb034bb9b3f475ca5740481",
        "conditions": [
          "Retain Apache-2.0 notices and preserve NVIDIA/Qwen provenance."
        ]
      },
      "artifactDecision": {
        "status": "allowed",
        "reason": "NVIDIA publishes the exact NVFP4 revision and a current Spark quantization/serving playbook.",
        "maximumDownloadBytes": 26000000000,
        "downloadState": "not_downloaded",
        "allowPatterns": [
          "*.json",
          "*.jinja",
          "*.safetensors",
          "*.model",
          "tokenizer*"
        ]
      },
      "precision": {
        "kind": "nvfp4",
        "nvfp4Applicability": "official-prequantized",
        "evidenceUri": "https://build.nvidia.com/spark/nvfp4-quantization/overview",
        "baselineCandidateId": "qwen36-35b-a3b-bf16",
        "comparisonReferences": []
      },
      "engine": {
        "name": "ngc-vllm",
        "compatibilityStatus": "documented-on-spark",
        "targetArchitecture": "linux/arm64/v8",
        "resourceMode": "node-exclusive",
        "notes": "Primary interactive Agent/LLM candidate; certification must compare the exact W4A16/FP8-attention recipe to the BF16 source under identical requests."
      },
      "selection": {
        "status": "planned",
        "rationale": "Current NVIDIA Spark-specific NVFP4 workflow, Apache license, ungated source, and approximately 23.5 GB repository snapshot."
      }
    },
    {
      "candidateId": "nemotron3-super-120b-a12b-nvfp4",
      "role": "stretch",
      "useCases": [
        "large_nvfp4_llm",
        "llm_agent"
      ],
      "source": {
        "publisher": "NVIDIA",
        "repository": "nvidia/NVIDIA-Nemotron-3-Super-120B-A12B-NVFP4",
        "revision": "4f0cf9daaeb7a4d5e23f80a00e7ed15f0e03caf6",
        "provenanceUri": "https://huggingface.co/nvidia/NVIDIA-Nemotron-3-Super-120B-A12B-NVFP4/tree/4f0cf9daaeb7a4d5e23f80a00e7ed15f0e03caf6",
        "artifactSourceUri": "https://huggingface.co/nvidia/NVIDIA-Nemotron-3-Super-120B-A12B-NVFP4/resolve/4f0cf9daaeb7a4d5e23f80a00e7ed15f0e03caf6/",
        "gated": false,
        "reportedRepositoryBytes": 80365683780
      },
      "license": {
        "identifier": "NVIDIA-Nemotron-Open-Model-License",
        "usage": "conditional-commercial",
        "reviewStatus": "conditional",
        "reviewedAt": "2026-08-10T19:41:32.000Z",
        "reviewedBy": "model-discovery-policy-v1",
        "evidenceUri": "https://huggingface.co/nvidia/NVIDIA-Nemotron-3-Super-120B-A12B-NVFP4/blob/4f0cf9daaeb7a4d5e23f80a00e7ed15f0e03caf6/README.md",
        "evidenceDigest": "sha256:4ea83df2c6f00a9238cb08bab7267bbf187d9442d4f8b2fe1463b9a63f4a8283",
        "conditions": [
          "Administrator must accept and retain the non-SPDX NVIDIA model terms before artifact import."
        ]
      },
      "artifactDecision": {
        "status": "blocked",
        "reason": "Commercial use is stated by the publisher, but the non-SPDX license still requires explicit administrator review.",
        "maximumDownloadBytes": null,
        "downloadState": "not_downloaded",
        "allowPatterns": []
      },
      "precision": {
        "kind": "nvfp4",
        "nvfp4Applicability": "official-prequantized",
        "evidenceUri": "https://build.nvidia.com/spark/trt-llm/overview",
        "baselineCandidateId": null,
        "comparisonReferences": [
          {
            "repository": "nvidia/NVIDIA-Nemotron-3-Super-120B-A12B-Base-BF16",
            "revision": "46cc6113d364942e7742b0b2afd35b5db5058b29",
            "precision": "bf16",
            "executionRequirement": "two-spark-or-external",
            "downloadStatus": "blocked-until-benchmark-plan"
          },
          {
            "repository": "nvidia/NVIDIA-Nemotron-3-Super-120B-A12B-FP8",
            "revision": "7d7e5797b8a3c7abbab54033b6004e93e8b6bc91",
            "precision": "fp8",
            "executionRequirement": "two-spark-or-external",
            "downloadStatus": "blocked-until-benchmark-plan"
          }
        ]
      },
      "engine": {
        "name": "tensorrt-llm",
        "compatibilityStatus": "documented-on-spark",
        "targetArchitecture": "linux/arm64/v8",